NCT Number,Study Title,Brief Summary,Conditions
NCT03971565,Evaluation of the Redox Profiles of Healthy and Pathological B Cells in Patients With Chronic Lymphocytic Leukemia,"In recent years, considerable progress has been made in understanding the biology of chronic lymphocytic leukemia (CLL), resulting in the emergence of new therapeutic agents that have significantly improved the long-term survival of patients. However, LLC is still considered an incurable disease.Cytogenetic abnormalities are frequently found in this pathology. Some abnormalities are associated with a more aggressive disease and a poor prognosis. The deletion of chromosome 17p (del (17p)), in particular, makes leukemic cells more resistant to standard therapy. Chromosome 17p contains the Tumor Protein 53 gene (TP53) which encodes the tumor suppressor protein 53 (P53) protein. P53 plays a central role in the regulation of important cellular functions such as DNA damage response, cell cycle regulation, apoptosis, and drug sensitivity of chemotherapies. In patients with CLL, the loss of p53 function is a major factor of chemoresistance and is associated with an adverse prognosis. The deletion (17p) is observed in approximately 5 to 10% of patients with CLL. In contrast, mutations in the TP53 gene are observed in approximately 30% of patients with CLL. This means that about one-third of patients with CLL have p53 dysfunction. TP53 and / or del (17p) mutated LLC cells show marked mitochondrial dysfunction. This dysfunction is responsible for a deregulation of intracellular redox phenomena, leading to an increase in oxidative stress and an overproduction of reactive oxygen derivatives (ROS).Dimethyl Ampal Thiolester (DIMATE) is an active, competitive and irreversible inhibitor of aldehyde dehydrogenases (ALDH) 1 and 3. In vitro, DIMATE eradicates human cells from acute myeloblastic leukemia (AML). In patients with CLL, current treatments, particularly effective, do not specifically target pathological B cells. This results in chronic B lymphopenia and hypogammaglobulinemias that provide severe long-term infections, which is the leading cause of death in patients with CLL.Through this study, we will study, in vitro, the expression of ALDH 1, 3, 9 but also of glutathione (GSH) and ROS on tumor B lymphocytes and healthy patients carrying an LLC. Depending on the differences in expression observed, DIMATE could specifically eradicate leukemic lymphocyte cells by sparing healthy lymphocytes, a hypothesis that will be tested in vitro. A special evaluation will be made in patients with del (17) and / or TP53 mutation whose prognosis is still considered unfavorable despite new therapeutic advances.",Chronic Lymphocytic Leukemia
NCT06886074,Efficacy of Short-course Blinatumomab for MRD Erradication in B-ALL,"Detectable measurable residual disease (MRD) is the most important prognostic factor for B-cell acute lymphoblastic leukemia (B-ALL) for overall survival (OS) and disease-free survival (DFS). Patients who are MRD positive and have no access to novel immunotherapies should receive an allogeneic hematopoietic stem cell transplantation (HSCT). Blinatumomab is considered a standard of care (SOC) for this group of patients, however, the ideal treatment dose for MRD is unknown as doses were adjusted from the relapsed/refractory setting. Preliminary data suggest short cycles of blinatumomab can also be effective in states of lower disease burden prior to transplant. Thus, the investigators are performing a phase 2 trial assessing 7 days of blinatumomab as a bridge to HSCTPrimary endpoint is assessing the MRD response following a short-course blinatumomab infusion in patients with B-ALL with complete response (CR) and have detectable MRD disease who are candidates for HSCT. Secondary endpoints include incidence of adverse events, OS, DFS, percentage of patients who receive HSCT, incidence of cytokine release syndrome (CRS) and immune effector cell associated neurotoxicity syndrome (ICANS)",Acute Lymphoblastic Leukemia|Measurable Residual Disease (MRD)
NCT01043874,Study to Evaluate Nilotinib in Chronic Myelogenous Leukemia (CML) Patients With SubOptimal Response,To evaluate the major molecular response (MMR) rate at 12 months of nilotinib treatment on study in patients with Philadelphia Chromosome Positive (Ph+) chronic myelogenous leukemia in chronic phase (CML-CP) who have a suboptimal molecular response to imatinib at 18 months or later.,Philadelphia Chromosome Positive|Chronic Myelogenous Leukemia in Chronic Phase
NCT00003174,Bryostatin 1 Plus Cladribine in Treating Patients With Relapsed Chronic Lymphocytic Leukemia,RATIONALE: Drugs used in chemotherapy use different ways to stop tumor cells from dividing so they stop growing or die. Combining more than one drug may kill more tumor cells.PURPOSE: This phase I trial is studying the side effects and best dose of cladribine when given with bryostatin 1 in treating patients with relapsed chronic lymphocytic leukemia.,Leukemia
NCT00646165,Trial of Forodesine in Patients With Relapsed B-cell Chronic Lymphocytic Leukemia,To determine the dose and duration of treatment for the best overall response with Forodesine in relapsed B-cell chronic lymphocytic leukemia,B-cell Chronic Lymphocytic Leukemia
NCT02343965,"The Impact of the Practice of Touch-massage on the Anxiety of Patients With Hematological Disorders Hospitalized in a Protective Environment, a Randomized, Controlled Study","Each year, 17000 cases of severe hematological diseases are diagnosed in France, with more than 6,000 of these requiring hospitalization in a protective, sterile environment. New methods, such as touch massage, have emerged in response to anxiety symptoms observed in patients in such sterile and isolated surroundings. We hypothesize that during the period of isolation, touch massage becomes a nursing care which can help the patient.",Hematologic Diseases
NCT03147365,Effect of Different Exercises on Quality of Life of Leukemia Patients.,* To compare between modified strength training program and aerobic exercises on quality of life on children with Acute Lymphoblastic Leukemia.* To compare between modified strength training program and aerobic exercises on functional capacity on children with Acute Lymphoblastic Leukemia.,Quality of Life|Acute Lymphoblastic Leukemia|Exercise
NCT00278265,Methotrexate Followed by Fludarabine in Patients With T-Cell Large Granular Lymphocytic Leukemia,"RATIONALE: Drugs used in chemotherapy, such as methotrexate and fludarabine, work in different ways to stop the growth of cancer cells, either by killing the cells or by stopping them from dividing.PURPOSE: This phase II trial is studying how well methotrexate works as first-line therapy and fludarabine works as second-line therapy in treating patients with T-cell large granular lymphocytic leukemia.",T-Cell Large Granular Lymphocytic Leukemia
NCT00861874,A Study of Decitabine in Combination With Escalating Doses of Rapamycin in Patients With Relapsed or Refractory Acute Myeloid Leukemia,The purpose of this study is to determine the safety and feasibility of the combination of decitabine given at a fixed dose with escalating doses of rapamycin in patients with relapsed or refractory acute myeloid leukemia.,Acute Myeloid Leukemia
NCT02828774,"Peptide-drug-conjugates for Personalized, Targeted Therapy of Chronic Lymphocytic Leukemia","Using phage libraries extensively pre-absorbed on a series of normal cell types, we will isolate phage specifically internalized by B-CLL cells from newly diagnosed and untreated CLL patients. Peptide sequences are then derived by Next Generation Sequencing (NGS). NGS-based studies are contributing to an improved understanding of cancer heterogeneity in order to tailor treatment to patients based on the individual makeup of their tumor. However the use of NGS to derive phage displayed peptide sequences is so far rare (22). Traditionally, after exposure to a target and recovery by elution, the phage clones are isolated by titration on bacterial lawns. It is technically demanding and labour intensive to select and analyze more than about 15 of the sometimes thousands clones recovered. Therefore information on other potentially important sequences is missed. NGS allows sequencing of the entire recovered phage pool and provides far more detailed bioinformatic analyses of peptide sequences or motifs. RNA from the CLL cells is used for RNA-seq expression sequencing. The wide application of NGS in combination with bioinformatics tools has begun to revolutionize cancer research, diagnosis and therapy. The peptide and RNA sequencing data will afford bioinformatic testing of correlations of exome expression and clinical parameters with the pattern of peptide sequences internalized by CLL cells of different patients. This information is crucial to answering questions 1, 2 and 3 discussed on page 1 above. The results of this analysis will probably not allow identification of specific receptors targeted by the peptides. The aim at this stage of the research is to identify candidate targeting peptides. Once identified, further research will be needed to identify the receptors to which they bind. Regarding question 4, there is currently very little published information on the therapeutic potential of PDCs in leukemia. Using two peptides we have isolated that target murine A20 leukemic cells, we will prepare multi-drug PDCs (using technology we have developed) and in an animal model, test their ability to enhance the survival and quality of life of CLL bearing animals.",CLL
NCT04828174,Anti-TRBC1 CAR-T Cell Therapy in Patients With TRBC1 Positive T Cell Malignancies,The purpose of this study is to evaluate the safety and efficacy of CAR T cell treatment targeting TRBC1 in patients with relapsed or refractory TRBC1 positive T-cell hematological maliganacies,Peripheral T Cell Lymphoma|Angioimmunoblastic T-cell Lymphoma|Anaplastic Lymphoma|Acute T Cell Leukemia|T-lymphoblastic Lymphoma
NCT02996474,Pembrolizumab and Decitabine for Refractory or Relapsed Acute Myeloid Leukemia,"Background:Acute myeloid leukemia (AML) is a cancer of the white blood cells. It is fatal if not treated. Treatment for AML that has not responded to treatment (refractory) or has returned after treatment (relapsed) often do not work. Researchers want to see if an immunotherapy drug, combined with a less intense chemotherapy, may be able to help.Objective:To test if pembrolizumab, in combination with decitabine, is a possible treatment for people with relapsed or refractory AML.Eligibility:Adults 18 years of age and older with refractory AML or relapsed AML.Design:Participants will be first screened for eligibility.The study is counted in 21-day cycles. The initial phase of the study consists of 8 cycles. Participants may be in the study for up to 2 years if they are responding to the treatment.The first 3 weeks of treatment is usually done in the hospital. The rest may be done as an outpatient.Participants will get pembrolizumab at the beginning of each cycle through an IV.Participants will usually get decitabine by IV on days 8 12 and days 15 19 of every other cycle.Participants will give blood samples.Participants will have bone marrow exams. A needle will be inserted into the hip to extract cells from the bone marrow.Some participants may give a sample of saliva from the inside of their cheek.Some participants may give a small skin sample. The top layer of the skin is removed.Some patients may require leukapheresis before starting treatment. This is a procedure to remove leukemia cells in the blood stream.",Relapsed Acute Myeloid Leukemia
NCT02451774,Pentoxifylline In Pediatric Acute Lymphoblastic Leukemia During Induction,"Recent advances in acute lymphoblastic leukemia treatment are based on a cytotoxic drug combination. Measurement of minimal residual disease in bone marrow samples at day 14 of treatment is the most powerful early predictive indicator of further relapse, and it can be applied practically to all patients with acute lymphoblastic leukemia. Even more so, it has been observed that patients who present negative minimal residual disease in bone marrow samples at day 7 during induction have a better prognosis than those achieving this at day 14.Relapse represents the main cause of treatment failure that related in the extreme with resistance to apoptosis, defining the latter as the principal mechanism of programmed cell death; it is also related with the induction of leukemic cells to senescent arrest.Pentoxifylline is a methyl-xanthine byproduct considered an unspecific inhibitor of phosphodiesterase. It inhibits nuclear factor-kappa-beta activation by different mechanisms and stimulates apoptosis induced by different drugs; thus, it can optimize the antineoplastic effect of actual treatments in order to increase the apoptosis of leukemic cells. This effect might improve the prognosis of these patients.Evaluate the safety and effect of Pentoxifylline together with antineoplastic drugs in order to study increased apoptosis and decreased senescence during the remission induction phase in pediatric patients with newly diagnosed acute lymphoblastic leukemia. To achieve this propose, we will divide patients in two groups, who will receive pentoxifylline or placebo depending on the group, in addition to conventional treatment according to the protocol standard chemotherapy schema for pediatric patients with acute lymphoblastic leukemia at our institution during the remission induction phase. In addition, we will test whether the study group exerts an impact on reaching remission earlier as compared with the control group.",Acute Lymphoblastic Leukemia
NCT02546674,Study Assessing Deep Molecular Response in Adult Patients With CML in Chronic Phase Treated With Nilotinib Firstline.,The main purpose of this study was to evaluate the rate of deep molecular response (MR4.5) after 24 months of therapy with nilotinib in newly diagnosed patients with chronic phase chronic myeloid leukemia (CML) using EUTOS (European Treatment and Outcome Study for CML)-standardized laboratories. All participants received nilotinib 300 mg twice daily (BID).,Chronic Myeloid Leukemia
NCT04744974,Remotely Administered Diet Intervention to Impact Symptom Burden in Myeloproliferative Neoplasm,"Myeloproliferative Neoplasm (MPN) is a chronic blood cancer without cure. The major clinical issues in MPN are 1) an increased risk of blood clots 2) symptoms thought to be driven by chronic inflammation which in some cases can be debilitating and 3) progression to acute leukemia. The current management of MPN focuses on preventing blood clots and relieving symptoms. However, treatments that reduce symptoms such as JAK inhibitors are limited to late stage MPN patients and have significant side effects including immunosuppression, reduction in platelets, and increased risk of skin cancer. Therefore, low risk interventions are sorely needed for MPN patients that can reduce symptoms. Diet represents a low risk way to reduce inflammation, specifically a Mediterranean diet has been found to reduce inflammation in cardiovascular disease. There has been a recently completed clinical trial that demonstrated MPN patients can adopt a Mediterranean diet if given dietician counseling and curriculum. However, in order to reach a larger group of people a fully remotely administered study is necessary. This is a feasibility study to determine.",Myeloproliferative Neoplasm
NCT02264574,A Multi-Center Study of Ibrutinib in Combination With Obinutuzumab Versus Chlorambucil in Combination With Obinutuzumab in Patients With Treatment naïve Chronic Lymphocytic Leukemia (CLL) or Small Lymphocytic Lymphoma (SLL),"The primary objective of this study is to evaluate the efficacy of ibrutinib in combination with obinutuzumab compared to chlorambucil in combination with obinutuzumab based on the Independent Review Committee (IRC) assessment of progression free survival (PFS). Efficacy will be evaluated according to 2008 International Workshop for Chronic Lymphocytic Leukemia (IWCLL) criteria with the modification for treatment-related lymphocytosis, in subjects with treatment-naive CLL or SLL.",Chronic Lymphocytic Leukemia|Small-Cell Lymphoma
NCT04952974,B-cell Chronic Lymphoid Malignancies Markers,"Lymphoid chronic B-cell malignancies are frequent pathologies that affect adults, with a very variable prognosis and treatment (some of them can remain untreated). The diagnosis of these malignancies relies on the study of the morphology of tumoral cells and the expression by these cells of several markers, mainly via a technical approach called flow cytometry. Because the markers currently used remain imperfect, additional ones are needed for an accurate diagnosis that affect both prognosis and treatment.In addition, because numerous markers are used at the diagnosis, there is a need of tools that synthetize the multi-dimensional structure of the data obtained.The primary purpose of this study is to detect new markers that can be of help for the diagnosis of Marginal Zone Lymphoma and other B-cell chronic lymphoid malignancies.The secondary purpose of this study is to obtain a statistical algorithm that allow a good prediction of the different sub-types of chronic B-cell malignancies mainly using the results of flow cytometry.",Chronic Lymphocytic Leukemia|Marginal Zone Lymphoma|Lymphoplasmacytic Lymphoma/Waldenström Macroglobulinemia|Mantle Cell Lymphoma|Hairy Cell Leukemia|Follicular Lymphoma
