NCT Number,Study Title,Brief Summary,Conditions
NCT01697020,Bioequivalence of An Oral Mercaptopurine Suspension 100 Mg / 5 Ml Versus Tablet in Healthy Male Subjects Under Fasting Conditions,"The primary objective of this study is to determine whether the test product, mercaptopurine oral 100 mg/5 mL suspension, and the reference product, Purinethol® 50 mg tablets are bioequivalent. For this purpose the PK profile of 6-mercaptopurine (6-MP) will be compared after administration of a single dose of each of the two formulations, under fasting conditions. The secondary objective is to assess the safety and tolerability of the test product, mercaptopurine oral 100 mg/5 mL suspension.",Acute Lymphoblastic Leukemia
NCT01400074,Efficacy of Nilotinib Versus Imatinib in Ph+ CML in Early CP Who Have a Suboptimal Molecular Response to Imatinib,"In this study, the efficacy of nilotinib at 400 mg BID will be compared with imatinib at 400 mg BID in suboptimal molecular response patients. To determine study eligibility, suboptimal molecular response will be defined as patients who have achieved a complete cytogenetic response (CCyR) but have not achieved a MMR, after at least 18 months of treatment on first line imatinib therapy at a minimum dose of 400mg daily (Baccarani 2006).",Chronic Myeloid Leukemia
NCT06345365,MA+AZA Regimen for the Treatment of Newly Diagnosed Acute Myeloid Leukemia (AML),"Investigator proposed to apply the new dosage form of mitoxantrone hydrochloride liposomes to the clinical treatment of AML, while combining with cytarabine and azacitidine to form the MA+AZA treatment regimen(Mitoxantrone liposome +Ara-Cytarabine+Azacitidine), which would provide an optimal induction treatment regimen for patients with primary AML by comparing with the traditional chemotherapy regimen, DA+AZA (Daunorubicin+Ara-Cytarabine+Azacitidine).",Acute Myeloid Leukaemia
NCT00074074,Infliximab in Treating Patients With Myelodysplastic Syndrome,"RATIONALE: Monoclonal antibodies, such as infliximab, can locate tumor cells and either kill them or deliver tumor-killing substances to them without harming normal cells.PURPOSE: Randomized phase II trial to study the effectiveness of infliximab in treating patients who have myelodysplastic syndrome.",Myelodysplastic Syndromes
NCT02527174,A Study of Volasertib Plus Induction Chemotherapy for Acute Myeloid Leukemia,This is a Phase I clinical trial to determine the maximum tolerated dose (MTD) of the polo-like kinase-1 inhibitor volasertib which can be safely combined with idarubicin plus cytarabine induction chemotherapy for previously untreated patients with acute myeloid leukemia. (AML).,"Leukemia, Myeloid, Acute|Leukemia, Monocytic, Acute|Leukemia, Myelomonocytic, Acute|Leukemia, Erythroblastic, Acute|Leukemia, Megakaryoblastic, Acute"
NCT06121765,Metabolic Alternation and Clinicohematological Characteristic in Chronic Phase CML in Patient Treated With TKI,Metabolic alternation and clinicohematological characteristic in chronic phase CML in patient treated with TKI,"CML, Chronic Phase"
NCT00020865,Levofloxacin Compared With Cefepime in Treating Cancer Patients With Fever and Neutropenia,RATIONALE: Levofloxacin may be effective in reducing fever and controlling other symptoms of neutropenia in patients who are being treated for cancer. It is not yet known whether levofloxacin is more effective than cefepime in reducing fever and controlling symptoms of neutropenia.PURPOSE: Randomized phase III trial to compare the effectiveness of levofloxacin with that of cefepime in reducing fever and controlling symptoms of neutropenia in patients who are being treated for cancer.,"Fever, Sweats, and Hot Flashes|Infection|Leukemia|Lymphoma|Neutropenia|Unspecified Adult Solid Tumor, Protocol Specific"
NCT00378365,Acute Promyelocytic Leukemia 2006 (APL),"To assess the role of Arsenic trioxide and/or ATRA during consolidation course in APL. It is hoped that the investigational arms will further increase the event-free survival at 2 years, with reduced toxicity and without increasing the relapse rate by comparison with a classical anthracycline-AraC consolidation regimen.","Leukemia, Promyelocytic, Acute"
NCT04223765,Study of Kappa Chimeric Antigen Receptor (CAR) T Lymphocytes Co-Expressing the Kappa and CD28 CARs for Relapsed/Refractory Kappa+ Non-Hodgkin Lymphoma and Chronic Lymphocytic Leukemia/Small Lymphocytic Lymphoma.,"This study will combine both T cells and antibodies in order to create a more effective treatment. The treatment tested in this study uses modified T-cells called Autologous T Lymphocyte Chimeric Antigen Receptor (ATLCAR) cells targeted against the kappa light chain antibody on cancer cells. For this study, the anti-kappa light chain antibody has been changed so instead of floating free in the blood, a part of it is now joined to the T cells. Only the part of the antibody that sticks to the lymphoma cells is attached to the T cells. When an antibody is joined to a T cell in this way, it is called a chimeric receptor. The kappa light chain chimeric (combination) receptor-activated T cells are called ATLCAR.κ.28 cells. These cells may be able to destroy lymphoma cancer cells. They do not, however, last very long in the body so their chances of fighting the cancer are unknown.Previous studies have shown that a new gene can be put into T cells to increase their ability to recognize and kill cancer cells. A gene is a unit of DNA. Genes make up the chemical structure carrying your genetic information that may determine human characteristics (i.e., eye color, height and sex). The new gene that is put in the T cells in this study makes an antibody called an anti-kappa light chain. This anti-kappa light chain antibody usually floats around in the blood. The antibody can detect and stick to cancer cells called lymphoma cells because they have a substance on the outside of the cells called kappa light chains.The purpose of this study is to determine whether receiving the ATLCAR.κ.28 cells is safe and tolerable and learn more about the side effects and how effective these cells are in fighting lymphoma. Initially, the study doctors will test different doses of the ATLCAR.κ.28, to see which dose is safer for use in lymphoma patients. Once a safe dose is identified, the study team will administer this dose to more patients, to learn about how these cells affect lymphoma cancer cells and identify other side effects they might have on the body.This is the first time ATLCAR.κ.28 cells are given to patients with lymphoma. The Food and Drug Administration (FDA), has not approved giving ATLCAR.κ.28 as treatment for lymphoma. This is the first step in determining whether giving ATLCAR.κ.28 to others with lymphoma in the future will help them.",Mantle Cell Lymphoma|Follicular Lymphoma|Splenic Marginal Zone Lymphoma|Extranodal Marginal Zone Lymphoma of Mucosa-Associated Lymphoid Tissue|Nodal Marginal Zone Lymphoma|Indolent Non-hodgkin Lymphoma
NCT06651866,Dose-escalation Study of D-CMG Regimen for the Treatment of Elderly Newly Diagnosed AML Patients,"to observe the dose-limiting toxicity (DLT) of liposomal mitoxantrone hydrochloride injection combined with cytarabine and decitabine in the initial treatment of acute myeloid leukemia (AML), to explore the maximum tolerated dose (MTD) of the combined D-CMG regimen, and to evaluate its safety and efficacy",Acute Myeloid Leukemia
NCT04937166,A Study of Dual-SIgnaling Protein 107 (DSP107) for Patients With Hematological Malignancies,"This study will be divided into two parts, Parts A and B and will enroll patients with relapsed/refractory AML or MDS/chronic myelomonocytic leukemia (CMML) patients who have failed up to 2 prior therapeutic regimens.Part A is a dose escalation study to explore the safety, efficacy, pharmacokinetic (PK) and pharmacodynamic (PD) profile of DSP107 when administered in combination with azacitidine (AZA).Part B is a dose escalation study to explore the safety, efficacy, PK and PD profile of DSP107 when administered in combination with AZA and venetoclax (VEN).",Acute Myeloid Leukemia|Myelodysplastic Syndromes|Chronic Myelomonocytic Leukemia
NCT05266274,Clinical Efficacy and Safety of CD47 Monoclonal Antibody Combined With Azacitidine in the Treatment of Recurrent AML After Transplantation,"After screening according to the criteria for selection and exclusion, patients who meet the criteria are selected, CD47 monoclonal antibody combined with azacitidine is used for the treatment of patients with recurrent AML after transplantation. The primary outcome is objective response rate (ORR).",Patients With Recurrent Acute Myelogenous Leukemia After Transplantation
NCT05586074,HEC73543 Versus Salvage Chemotherapy in R/R FLT3-ITD AML,"A randomized，multicenter, open-label Phase III, clinical study is conducted to evaluate the clinical benefit Clifutinib in Chinese patients with relapsed/ refractory (R/R) FLT3-mutated AML as shown with overall survival compared to salvage chemotherapy, and also to investigate the efficacy of Clifutinib as assessed by CR/CRh rate in these subjects.","Leukemia, Acute Myeloid (AML)"
NCT00861965,Bioengineered Allogeneic Immune Cells (AlloStim) Not Requiring HLA Donor Match for Blood Cancers,"This phase I/II clinical investigation is designed to determine the safety and anti-tumor effects of intravenous administration of the experimental immunotherapy drug, called AlloStim. The active ingredient of AlloStim is living, human immune cells that have been differentiated and expanded outside the body. Because AlloStim does not require HLA match, it is being evaluated as an alternative to allogeneic bone marrow/stem cell transplantation.","Advanced or Refractory Leukemia, Lymphoma, Multiple Myeloma"
NCT00219765,Safety and Efficacy of Imatinib in Combination With High Dose Chemotherapy for Acute Phase Chronic Myelogenous Patients,The aim of this phase I/II trial is to determine the dose of daunorubicine to be associated with cytarabine and Imatinib for induction therapy in patients with chronic myelogenous leukemia in myeloid acute phase.,Chronic Myeloid Leukemia
NCT03902665,Up-front Hematopoietic Stem Cell Transplantation in Acute Myeloid Leukemia Patients Aged 65-75,"Patients with acute myeloid leukemia aged 65-75 have a very poor prognosis, irrespective of the treatment strategy, including demethylating agents or conventional chemotherapy. With these approaches, remission rates do not exceed 40%, and overall disease-free survival at 1 year is in the order of 15%. The hypothesis is that up-front allogeneic hematopoietic stem cell transplant will produce a complete remission rate of 60% on day +56-70, and disease-free survival at 1 year of 30%. This is a single arm phase II study of upfront allogeneic stem cell transplantation, for patients with acute myeloid leukemia aged 65-75: the primary endpoint is a complete remission rate on day +56-70. The secondary endpoint is a 1-year overall disease-free survival of 30%.","Acute Myeloid Leukemia, Adult"
NCT03967665,Risk Stratification-directed NAC for Prevention of Poor Hematopoietic Reconstitution,"Allogeneic hematopoietic stem cell transplantation (allo-HSCT) is an effective treatment of malignant hematopoietic diseases. However, poor hematopoietic reconstitution including poor graft function (PGF) and prolonged isolated thrombocytopenia (PT), remains a life-threatening complication after allo-HSCT. Especially with the increasing use of haploidentical allo-HSCT (haplo-HSCT) in the past ten years, PGF and PT have become growing obstacles contributing to high morbidity and mortality after allo-HSCT. Due to the limited mechanism studies, the clinical management of PGF and PT is challenging.Recent prospective case-control studies reported that the reduced and dysfunctional bone marrow (BM) endothelial cells (ECs) after allo-HSCT are involved in the pathogenesis of PGF and PT. Moreover, in vitro treatment with N-acetyl-L-cysteine (NAC) could enhance the defective hematopoietic stem cell (HSC) function through repairing the dysfunctional BM ECs of PGF and PT patients. The investigators performed a small-scale pilot cohort study and saw encouraging clinical results that oral administration with NAC could partially repair the dysfunctional BM ECs and improve megakaryocytopoiesis in PT patients, which suggests that NAC is a promising drug in PT patients after allo-HSCT. In addition, prior prospective trial of the investigators suggests that BM ECs\<0.1% pre-HSCT is the risk factor for occurrence of the PGF and PT two months following allo-HSCT. Previous single-arm clinical cohort studies of the investigators showed that prophylactic use of NAC before allo-HSCT reduced the incidence of poor hematopoietic reconstitution after allo-HSCT in patients with ECs \<0.1% pre-HSCT.Therefore, the investigators designed the study with acute leukemia patients who will be scheduled to receive haplo-HSCT. The patients who are in the first complete remission at time of haplo-transplant will be enrolled in the study. Exclusive criteria are bronchila asthma and NAC allergy. The enrolled patients were risk-stratified into BM ECs≥0.1% group (low-risk group) and BM ECs\<0.1% group (high-risk group). Patients in high-risk group (ECs\<0.1%) will be randomized to 1 of 2 arms: (a) NAC 400 mg three times per day from 14 days pre-HSCT to 2 months post-HSCT, (b) No-NAC concurrent control according to a 2:1 schedule. The aim of the trail is to assess the effects of NAC for prevention of poor hematopoietic reconstitution in patients with acute leukemia undergoing haplo-HSCT.",Stem Cell Transplant Complications
NCT05367765,A Real World Study of the Efficacy and Safety of Flumatinib Versus Imatinib in Patients With Newly Diagnosed Chronic Myeloid Leukemia in Chronic Phase,"Flumatinib is an orally available TKI with high selectivity and potency against BCR-ABL1 kinase. It's a multi-center, open-label, real world study to explore the efficacy and safety of Flumatinib versus Imatinib as the first line therapy in patients with chronic myleiod leukemia(CML) in chronic phase(CP).","CML, Chronic Phase"
NCT05736965,A Study of Selinexor in Combination With Azacitidine and Venetoclax (SAV Regimen) in Treatment Naïve Participants With Acute Myeloid Leukemia,"This is a prospective, single-arm, multi-center clinical trial to evaluate the efficacy and safety of selinexor in combination with azacitidine and venetoclax for untreated acute myeloid leukemia.","AML, Adult"
NCT04224974,Emotion and Symptom-Focused Engagement Trial for Individuals With Acute Leukemia,"The purpose of this study is to find out whether a novel manualized intervention, called Emotion and Symptom-focused Engagement (EASE), that combines psychological support with symptom screening plus triggered referral to early palliative care for symptom control, reduces psychological distress and physical symptom burden in individuals newly diagnosed with acute leukemia. To do this, half of the participants in this study will receive the usual care offered to patients with acute leukemia and half of the participants will receive usual care plus the EASE intervention.",Acute Leukemia
NCT05410574,Family-Based Behavioral Treatment for Childhood Survivors of Acute Lymphoblastic Leukemia,"A single-arm, non-randomized four-month trial of the adapted family-based behavioral weight loss treatment (FBT) intervention will be conducted to evaluate its acceptability, feasibility, and preliminary indications of efficacy including measures of relative weight change and associated secondary outcomes (e.g., weight related health behaviors, health related quality of life), among 40 childhood acute lymphoblastic leukemia (ALL) survivors and their families.",Acute Lymphoblastic Leukemia
NCT05743465,"A Study to Evaluate Available Treatment Information of Ponatinib, Bosutinib, Imatinib, Dasatinib and Nilotinib in Adults With Chronic Myeloid Leukemia","The aims of this study are to learn out about treatment information (including amongst others treatment patterns, safety, development of a participant's condition) ponatinib, bosutinib, imatinib, dasatinib and nilotinib using already available data. No new data will be collected from participants as part of this study and no study medicines will be provided in this study.",Leukemia
NCT06250465,AGMT Austrian CLL (Chronic Lymphocytic Leukemia) Registry,"For until very recently CLL has been considered an uncurable disease, with the only few exceptions of a part of patients capable of undergoing and successfully standing allogeneic stem cell transplant. However, the introduction of chemoimmunotherapy in particular the FCR (fludarabine, cyclophosphamide, rituximab) regimen has established a relevant population of IgVH mutated patients, who remain relapse-free for up to 10 years with a clear plateau at this level. However, for the largest proportion of all CLL patients the disease is still associated with a reduction in life expectancy as compared to a matched population.The field has made further substantial progress by the introduction of BTK inhibitors and Bcl2 inhibitors, novel antibodies as well as by the understanding of the role of minimal residual disease (MRD), mutations and their clonal evolution over time as risk factors and factors governing the kind and duration of therapy.Due to the limited follow up of frontline therapy trials using novel drugs, it is not yet clear, what the long-term results with many of the new drugs will be. Particularly, long-term PFS, the potential for cure and the long-term safety issues remain relevant parameters requiring examination, as are infections, interactions with other drugs or quality of life issues.CLL has not been systematically assessed in Austria to date. This medical registry of the AGMT is thus the first Austrian-wide standardized documentation of this disease.",Chronic Lymphocytic Leukemia
NCT01570465,Prospective Study on Severe Infections on Acute Myeloid Leukemia (AML) Patients,"All patients receiving induction, consolidation and salvage chemotherapy, and autologous or allogeneic stem cell transplantation according to a strategy defined in the GIMEMA AML1310 protocol will be prospectively monitored for SI (bacteremia, invasive mycoses, other microbiologically documented bacterial infections, pneumonia, other invasive tissue infections and viral diseases) during each chemotherapy and transplant and the impact of these infections on survival will be evaluated until 24 months from the diagnosis of AML.",AML|Adult
NCT00982566,Assess the Oral Bioavailability of a New ABT-263 Formulation in Subjects With Cancer,"This is a randomized, single dose, open-label, multicenter crossover study to determine the oral bioavailability of a new ABT-263 formulation relative to that of the current ABT-263 formulation being administered in ongoing Phase 1/2a studies. Approximately 48 evaluable subjects with lymphoid malignancies, including chronic lymphocytic leukemia, and solid tumors will be enrolled in this study.",Lymphoid Malignancy|Solid Tumors
NCT02172365,"Allogeneic SCT for CML, TKI Failure After TKI Failure","The investigators will evaluate the outcomes of allogeneic stem cell transplantation which is the only curative treatment modality in the patients with chronic myeloid leukemia after failing tyrosine kinase inhibitor therapy. However, any update was not reported on the transplant outcomes in the patients failed TKI therapy, thus necessitating update of this data. Also, the European Group for Blood and Marrow Transplantation (EBMT) risk score is still of value, but insufficient numbers of patients have been transplanted in recent years and after TKI therapy to allow a robust reanalysis. Our study hypothesis is that allogeneic SCT treatment modality can rescue CML patients who failed TKI therapy due to resistance or to intolerance with improved survival and long-term outcomes. Also, another hypothesis will be examined if the EBMT risk score proposed pre-imatinib era can reproduce similar prognostic risk stratification of long-term outcomes in the patients treated with TKI.",Chronic Myeloid Leukemia
NCT02619565,Prospective Study of Molecular Predictors of Survival in Myelodysplastic Syndromes,"This study aims at prospectively enrolling a cohort of 400 incident cases of myelodysplastic syndromes (MDS) at diagnosis, to evaluate the impact of recurrent mutations on overall survival and event-free survival, using next generation sequencing. Patients are affected by ineffective hematopoiesis and a propensity to leukemia in the elderly with a global incidence of 10/100,000/year.",Myelodysplastic Syndromes
NCT04626765,CAR-T for Children With Relapsed and Refractory Acute Lymphoblastic Leukemia,"In this study, CAR-T will be administered to children with acute lymphoblastic leukemia to explore the effect of CAR-T intervention time on the duration of complete remission and further verify the long-term safety and efficacy of CAR-T treatment.",Childhood Acute Lymphoblastic Leukemia
NCT03262974,Effect of Pharmacogenetics on Imatinib Plasma Level and Response,"Imatinib, the tyrosine kinase inhibitor, is used for treatment of Philadelphia positive chronic myeloid leukemia. Despite its efficacy and favorable pharmacokinetic profile, there is a large inter-individual variability in imatinib plasma concentrations, which may lead to treatment failure and disease progression. Polymorphisms in genes related to absorption, distribution, metabolism and excretion of imatinib may affect the bioavailability and consequently the response to the drug.The study aims to investigate the possible effect of genetic polymorphisms in certain metabolizing enzymes \[CYP3A5\*3 (rs776746), CYP2C8\*3 (rs11572080 and rs10509681)\] and membrane transporters \[ABCB1 2677G\>T/A (rs2032582) and SLC22A1 1222A \> G (rs628031)\] by PCR on the plasma level (by HPLC-UV) and molecular response (MMR) of imatinib in patients with CML.The study also aims to provide CML patients with a personalized treatment option, thereby probably improving the response and reducing the side effects.",Chronic Myeloid Leukemia
NCT01067274,ALFA-0703 Study in Older Patients With Acute Myeloblastic Leukemia (AML),"A Randomized Multicenter Phase III Study to Evaluate the Role of All-trans Retinoic Acid (ATRA) in Combination with Induction Chemotherapy, or Azacitidine and Idarubicin as salvage therapy and Idarubicin with Cytarabine or Azacitidine as Maintenance Therapy in Older Patients with Acute Myeloblastic Leukemia (AML).To compare the outcome of elderly patients with newly-diagnosed AML treated with standard induction chemotherapy and post-remission therapy, in only patients in CR, with either azacitidine or cytarabine combined to idarubicin +/- ATRA and salvage therapy with azacitidine combined to idarubicin +/- ATRA.",Acute Myeloid Leukemia
NCT06367374,MRD Guided Sonrotoclax and Zanubrutinib in Newly Diagnosed CLL/SLL,"This is a single-arm, open-label study of sonrotoclax plus zanubrutinib with MRD-driven treatment duration in patients with previously untreated Chronic Lymphocytic Leukemia (CLL) or Small Lymphocytic Lymphoma (SLL).The primary goal of this study is to evaluate the efficacy of MRD-guided zanubrutinib plus sonrotoclax for first-line CLL/SLL treatment.",Chronic Lymphocytic Leukemia|Small Lymphocytic Lymphoma
NCT05983965,Study of Tazemetostat in Lymphoid Malignancies,"Tazemetostat is an oral EZH2 inhibitor which has been FDA approved for adult patients with relapsed or refractory (R/R) follicular lymphoma (FL) whose tumors are positive for an EZH2 mutation as detected by an FDA-approved test and who have received at least 2 prior systemic therapies, and for adult patients with R/R FL who have no satisfactory alternative treatment option. We propose a study to evaluate the safety of tazemetostat in relapsed / refractory peripheral T-cell lymphoma.",T-cell Lymphoma
NCT01188174,Clofarabine/Ara-C Treatment Combined With Reduced-intensity Conditioning Allogeneic Stem Cell Transplantation for Acute Myeloid Leukemia in Primary Treatment Failure,"The present trial will establish a prospective sequential Allogeneic Stem Cell Transplantation (allo-SCT) treatment combining both salvage chemotherapy and Reduced Intensity Conditioning (RIC) for primary treatment failure Acute Myeloid Leukemia (AML), to which future innovative strategies can be compared.",AML
